State Postal Code,State FIPS Code,District ID,Name,Estimated Total Population,Estimated Population 5-17,Estimated number of relevant children 5 to 17 years old in poverty who are related to the householder
IN,18,60,Adams Central Community Schools,9076,2521,625
IN,18,120,Alexandria Community School Corporation,8648,1465,318
IN,18,150,Anderson Community School Corporation,70432,10424,2854
IN,18,180,Argos Community Schools,3784,711,135
IN,18,210,Attica Consolidated School Corporation,4760,801,143
IN,18,270,Avon Community School Corporation,51391,10303,599
IN,18,330,Barr-Reeve Community School Corporation,5707,1461,207
IN,18,360,Bartholomew County School Corporation,76607,13162,1475
IN,18,390,Batesville Community School Corporation,11972,2243,216
IN,18,420,Baugo Community Schools,9812,2020,180
IN,18,450,Beech Grove City Schools,14647,2675,636
IN,18,480,Benton Community School Corporation,11066,2086,295
IN,18,570,Blackford County Schools,11930,1938,394
IN,18,600,Bloomfield School District,6689,1069,183
IN,18,660,Blue River Valley Schools,6577,712,98
IN,18,720,Bluffton-Harrison Metropolitan School District,8698,1539,214
IN,18,750,Boone Township Metropolitan School District,6358,1065,113
IN,18,900,Bremen Public Schools,8750,1812,140
IN,18,960,Brown County County School Corporation,15234,2153,304
IN,18,1020,Brownsburg Community School Corporation,46284,9304,461
IN,18,1050,Brownstown Central Community School Corporation,10790,1930,231
IN,18,1060,C. A. Beard Memorial School Corporation,7877,1318,173
IN,18,1170,Cannelton City Schools,1544,270,89
IN,18,1200,Carmel Clay Schools,100132,20756,598
IN,18,1290,Carroll Consolidated School Corporation,6558,1097,90
IN,18,1410,Caston School Corporation,4476,765,89
IN,18,1440,Center Grove Community School Corporation,45443,8935,441
IN,18,1560,Centerville-Abington Community Schools,8156,1583,266
IN,18,1710,Central Noble Community School Corporation,8750,1432,138
IN,18,2880,City of East Chicago School District,28998,5812,2725
IN,18,1890,Clark-Pleasant Community School Corporation,36078,6861,690
IN,18,1920,Clarksville Community School Corporation,9701,1451,280
IN,18,840,Clay Community Schools,25467,4287,889
IN,18,2130,Clinton Central School Corporation,5205,1040,118
IN,18,2160,Clinton Prairie School Corporation,5641,962,97
IN,18,2220,Cloverdale Community Schools,7388,1152,202
IN,18,2400,Concord Community Schools,26707,5101,676
IN,18,2430,Covington Community School Corporation,5255,839,92
IN,18,7020,Cowan Community School Corporation,3637,616,64
IN,18,2440,Crawford County Community School Corporation,10940,1774,393
IN,18,2460,Crawfordsville Community Schools,15657,2399,459
IN,18,12060,Crothersville Community Schools,3555,578,81
IN,18,2490,Crown Point Community School Corporation,40900,7182,573
IN,18,2520,Culver Community Schools Corporation,6848,1121,186
IN,18,9840,Daleville Community Schools,3932,628,88
IN,18,2550,Danville Community School Corporation,15576,2989,165
IN,18,1590,DeKalb County Central United School District,24698,4238,393
IN,18,3060,DeKalb County Eastern Community School District,8020,1535,191
IN,18,2610,Decatur County Community Schools,12477,2326,257
IN,18,2640,Decatur Township Metropolitan School District,34211,7260,1293
IN,18,2660,Delaware Community School Corporation,14637,2460,367
IN,18,2700,Delphi Community School Corporation,9631,1622,182
IN,18,2800,Duneland School Corporation,35733,6284,577
IN,18,2850,East Allen County Schools,70150,14464,2548
IN,18,2940,East Gibson School Corporation,6823,1066,123
IN,18,2970,East Noble School Corporation,23160,3928,452
IN,18,9000,East Porter County School Corporation,13325,2289,147
IN,18,3000,East Washington School Corporation,9606,1727,320
IN,18,3030,Eastbrook Community School Corporation,10094,1559,267
IN,18,3090,Eastern Greene County School District,7796,1436,200
IN,18,3120,Eastern Hancock County Community School Corporation,6292,1132,78
IN,18,3150,Eastern Howard School Corporation,6453,1208,87
IN,18,7110,Eastern Pulaski Community School Corporation,6976,1135,176
IN,18,3240,Edinburgh Community School Corporation,5510,897,178
IN,18,3270,Elkhart Community Schools,78705,14802,2880
IN,18,3300,Elwood Community School Corporation,9929,1631,380
IN,18,3330,Eminence Community School Corporation,2981,505,44
IN,18,3450,Evansville-Vanderburgh School Corporation,180974,28126,5309
IN,18,3480,Fairfield Community Schools,12353,3021,215
IN,18,3510,Fayette County School Corporation,23047,3794,695
IN,18,3570,Flat Rock-Hawcreek School Corporation,5897,1066,93
IN,18,3630,Fort Wayne Community Schools,226858,39304,9156
IN,18,3660,Frankfort Community Schools,17688,3381,580
IN,18,3690,Franklin Community School Corporation,33395,5815,716
IN,18,3700,Franklin County Community School Corporation,17144,2860,322
IN,18,3750,Franklin Township Community School Corporation,55952,11540,933
IN,18,12880,Frankton-Lapel Community Schools,12068,2175,228
IN,18,3780,Fremont Community Schools,7134,1009,117
IN,18,3810,Frontier School Corporation,4013,747,60
IN,18,3840,Garrett-Keyser-Butler Community Schools,9596,1784,242
IN,18,3870,Gary Community School Corporation,73469,13781,6758
IN,18,3930,Goshen Community Schools,37971,7033,978
IN,18,3940,Greater Clark County Schools,78951,12648,1803
IN,18,3960,Greater Jasper Consolidated Schools,19853,3443,311
IN,18,3990,Greencastle Community School Corporation,14094,1937,277
IN,18,4050,Greenfield-Central Community Schools,29944,4930,350
IN,18,4080,Greensburg Community Schools,14652,2501,411
IN,18,4110,Greenwood Community School Corporation,27384,4516,516
IN,18,4170,Griffith Public Schools,16424,2704,452
IN,18,4230,Hamilton Community Schools,4399,658,104
IN,18,4260,Hamilton Heights School Corporation,15461,2742,175
IN,18,10650,Hamilton Southeastern Schools,108325,23167,789
IN,18,4320,Hammond School City,79276,14501,4390
IN,18,4350,Hanover Community School Corporation,12140,2117,140
IN,18,4560,Highland School Town,23181,3375,373
IN,18,4590,Hobart School City,23426,3739,692
IN,18,4710,Huntington County Community School Corporation,36240,5746,712
IN,18,4770,Indianapolis Public Schools,313024,50828,16724
IN,18,4800,Jac-Cen-Del Community School Corporation,5040,849,170
IN,18,4980,Jay School Corporation,20764,3807,692
IN,18,5190,Jennings County Schools,27611,4717,860
IN,18,9120,John Glenn School Corporation,9964,1874,157
IN,18,5280,Kankakee Valley School Corporation,20096,3647,355
IN,18,5340,Knox Community School Corporation,10872,1884,401
IN,18,5370,Kokomo-Center Township Consolidated School Corporation,45017,6958,1623
IN,18,5580,La Porte Community School Corporation,38146,6301,1084
IN,18,5400,Lafayette School Corporation,62939,9900,2039
IN,18,5450,Lake Central School Corporation,65146,10731,724
IN,18,5460,Lake Ridge Schools,11901,1998,785
IN,18,2910,Lake Station Community Schools,8381,1410,382
IN,18,5520,Lakeland School Corporation,15529,3094,390
IN,18,3720,Lanesville Community School Corporation,4207,726,41
IN,18,5670,Lawrence Township Metropolitan School District,101158,19184,2911
IN,18,5700,Lawrenceburg Community School Corporation,10944,1724,269
IN,18,5790,Lebanon Community School Corporation,25549,4167,334
IN,18,5880,Liberty-Perry Community School Corporation,6039,997,124
IN,18,5910,Linton-Stockton School Corporation,8151,1306,233
IN,18,6030,Logansport Community School Corporation,23365,3919,686
IN,18,6060,Loogootee Community School Corporation,5748,974,126
IN,18,6090,Maconaquah School Corporation,14798,2135,384
IN,18,6120,Madison Consolidated Schools,22847,3400,697
IN,18,6240,Madison-Grant United School Corporation,8265,1411,228
IN,18,6270,Manchester Community Schools,9911,1362,216
IN,18,6390,Marion Community Schools,34677,4839,1568
IN,18,6510,Martinsville Schools Metropolitan School District,31074,5103,832
IN,18,1230,Medora Community School Corporation,1572,299,78
IN,18,9690,Merrillville Community School,46260,7385,1568
IN,18,6570,Michigan City Area Schools,47839,7022,2199
IN,18,6600,Middlebury Community Schools,22794,5359,434
IN,18,6630,Milan Community Schools,6155,1141,133
IN,18,6660,Mill Creek Community School Corporation,10710,1960,219
IN,18,6840,Mishawaka School City,30848,5347,878
IN,18,6870,Mississinewa Community School Corporation,10238,1805,380
IN,18,6900,Mitchell Community Schools,11899,1952,260
IN,18,7080,Monroe Central School Corporation,5374,899,116
IN,18,630,Monroe County Community School Corporation,128542,13284,1688
IN,18,4140,Monroe-Gregg School District,8032,1379,129
IN,18,7140,Mooresville Consolidated School Corporation,24531,4291,599
IN,18,7230,Mount Pleasant Township Community School Corporation,13755,2297,279
IN,18,7260,Mount Vernon Community School Corporation,21169,3879,192
IN,18,7290,Mount Vernon Metropolitan School District,15675,2636,322
IN,18,7320,Muncie Community Schools,67499,7612,2469
IN,18,7350,Munster School Town,23022,4051,260
IN,18,7380,Nettle Creek School Corporation,6807,1292,205
IN,18,7410,New Albany-Floyd County Consolidated Schools,77781,12963,1801
IN,18,7440,New Castle Community School Corporation,22773,3546,619
IN,18,7470,New Durham Township Metropolitan School District,8550,886,117
IN,18,7560,New Prairie United School Corporation,15258,2729,406
IN,18,7620,Nineveh-Hensley-Jackson United School Corporation,11310,1993,215
IN,18,7650,Noblesville Schools,60792,11457,586
IN,18,7680,North Adams Community Schools,15643,2722,308
IN,18,118,North Central Parke Community School Corporation,11059,1613,368
IN,18,7710,North Daviess Community Schools,9303,2254,253
IN,18,7770,North Gibson School Corporation,14331,2411,309
IN,18,690,North Harrison Community School Corporation,14094,2451,286
IN,18,7800,North Judson-San Pierre School Corporation,7322,1275,228
IN,18,7830,North Knox School Corporation,8488,1389,248
IN,18,7860,North Lawrence Community Schools,33769,5450,895
IN,18,7890,North Miami Community Schools,5874,1040,114
IN,18,7900,North Montgomery Community School Corporation,12090,2188,211
IN,18,7920,North Newton School Corporation,9081,1429,158
IN,18,7950,North Posey County Schools Metropolitan School District,9865,1600,106
IN,18,7980,North Putnam Community Schools,10173,1722,186
IN,18,8010,North Spencer County School Corporation,11685,1906,164
IN,18,8070,North Vermillion Community School Corporation,4283,681,144
IN,18,8100,North West Hendricks Schools,11053,2230,91
IN,18,8130,North White School Corporation,5954,965,173
IN,18,8120,Northeast Dubois County School Corporation,5500,977,72
IN,18,8160,Northeast School Corporation,8364,1315,249
IN,18,8190,Northeastern Wayne Schools,5583,1065,232
IN,18,8220,Northern Wells Community Schools,15488,2823,277
IN,18,8250,Northwest Allen County Schools,37042,7910,378
IN,18,8310,Northwestern Consolidated School Corporation,7713,1428,203
IN,18,2040,Northwestern School Corporation,8659,1570,167
IN,18,8340,Oak Hill United School Corporation,7381,1284,181
IN,18,8460,Oregon-Davis School Corporation,4329,707,103
IN,18,8490,Orleans Community Schools,4683,835,161
IN,18,8640,Paoli Community School Corporation,9150,1532,363
IN,18,8760,Penn-Harris-Madison School Corporation,62038,11955,769
IN,18,1740,Perry Central Community School Corporation,7268,1105,108
IN,18,8820,Perry Township Metropolitan School District,99211,16651,2599
IN,18,8850,Peru Community Schools,13010,2126,465
IN,18,8900,Pike County School Corporation,12410,2008,240
IN,18,8910,Pike Township Metropolitan School District,77727,13818,2404
IN,18,8940,Pioneer Regional School Corporation,5065,869,103
IN,18,8970,Plainfield Community School Corporation,31995,5200,384
IN,18,9060,Plymouth Community School Corporation,19243,3456,515
IN,18,9150,Portage Township Schools,48602,8414,1374
IN,18,9180,Porter Township School Corporation,9610,1551,114
IN,18,9300,Prairie Heights Community School Corporation,9966,1583,155
IN,18,1770,Randolph Central School Corporation,9388,1529,284
IN,18,3180,Randolph Eastern School Corporation,4965,869,202
IN,18,10740,Randolph Southern School Corporation,3089,540,106
IN,18,9420,Rensselaer Central School Corporation,10683,1748,214
IN,18,9480,Richland-Bean Blossom Community School Corporation,18375,3214,343
IN,18,9510,Richmond Community School Corporation,40233,5927,1373
IN,18,9600,Rising Sun-Ohio County Community Schools,5844,844,90
IN,18,4620,River Forest Community School Corporation,7274,1261,433
IN,18,9630,Rochester Community School Corporation,11275,1835,391
IN,18,9720,Rossville Consolidated School District,4978,1033,79
IN,18,9750,Rush County Schools,14597,2481,366
IN,18,9810,Salem Community Schools,12682,1987,403
IN,18,9990,Scott County School District 1,6572,1177,280
IN,18,10020,Scott County School District 2,17306,2817,476
IN,18,10080,Seymour Community Schools,28194,4999,734
IN,18,10110,Shakamak Schools Metropolitan School District,5211,892,154
IN,18,3210,Shelby Eastern Schools,8487,1396,122
IN,18,10140,Shelbyville Central Schools,23666,3928,652
IN,18,8280,Shenandoah School Corporation,7293,1262,171
IN,18,6480,Sheridan Community Schools,7299,1312,107
IN,18,10170,Shoals Community School Corporation,4469,688,114
IN,18,10230,Smith-Green Community Schools,7547,1318,96
IN,18,10260,South Adams Schools,10917,2584,789
IN,18,10290,South Bend Community School Corporation,162405,26456,5285
IN,18,2190,South Central Community School Corporation,4042,727,60
IN,18,240,South Dearborn Community School Corporation,17235,2874,399
IN,18,10350,South Gibson School Corporation,12298,2269,165
IN,18,10360,South Harrison Community Schools,21667,3454,450
IN,18,10380,South Henry School Corporation,4354,717,77
IN,18,10410,South Knox School Corporation,5936,1093,136
IN,18,10440,South Madison Community School Corporation,25730,4550,373
IN,18,10450,South Montgomery Community School Corporation,10599,1946,266
IN,18,10470,South Newton School Corporation,5107,801,134
IN,18,10500,South Putnam Community Schools,9601,1191,147
IN,18,10530,South Ripley Community School Corporation,7608,1229,203
IN,18,10560,South Spencer County School Corporation,8642,1477,195
IN,18,10590,South Vermillion Community School Corporation,11196,1853,331
IN,18,10640,Southeast Dubois County School Corporation,7414,1292,111
IN,18,10620,Southeast Fountain School Corporation,6740,1111,157
IN,18,10680,Southeastern School Corporation,8236,1379,161
IN,18,10710,Southern Hancock County Community School Corporation,18946,3495,151
IN,18,10770,Southern Wells Community Schools,4020,781,61
IN,18,30,Southwest Allen County Metropolitan School District,41301,8594,487
IN,18,10870,Southwest Dubois County School Corporation,9798,1717,199
IN,18,10900,Southwest Parke Community School Corporation,5151,889,178
IN,18,10860,Southwest School Corporation,12326,1621,242
IN,18,10800,Southwestern Jefferson County Consolidated Schools,9361,1323,273
IN,18,10830,Southwestern Shelby County Consolidated Schools,4392,794,90
IN,18,10920,Speedway School Town,12483,1830,340
IN,18,10950,Spencer-Owen Community Schools,17368,2761,475
IN,18,10980,Springs Valley Community School Corporation,5656,903,154
IN,18,11100,Steuben County Metropolitan School District,18285,2730,416
IN,18,11190,Sunman-Dearborn Community School Corporation,24365,4413,304
IN,18,11220,Switzerland County School Corporation,10717,1971,540
IN,18,11250,Taylor Community School Corporation,9244,1457,201
IN,18,11260,Tell City-Troy Township School Corporation,10290,1606,221
IN,18,11340,Tippecanoe School Corporation,100135,15736,1481
IN,18,11370,Tippecanoe Valley School Corporation,11748,2098,314
IN,18,11400,Tipton Community School Corporation,10344,1570,160
IN,18,8040,Tipton County Northern Community School Corporation,4784,752,64
IN,18,11430,Tri-County School Corporation,4248,779,92
IN,18,11460,Tri-Creek School Corporation,20089,3583,345
IN,18,107,Tri-Township Consolidated School Corporation,2939,454,50
IN,18,11490,Triton School Corporation,5929,1195,108
IN,18,11580,Twin Lakes School Corporation,14435,2386,300
IN,18,11610,Union County-College Corner Joint School District,7401,1117,169
IN,18,11730,Union School Corporation,2835,472,96
IN,18,11700,Union Township School Corporation,9100,1635,106
IN,18,11910,Union-North United School Corporation,7991,1451,185
IN,18,11970,Valparaiso Community Schools,44672,6720,595
IN,18,12090,Vigo County School Corporation,107386,15775,2758
IN,18,12120,Vincennes Community School Corporation,22471,3232,687
IN,18,12240,Wa-Nee Community Schools,20403,4520,385
IN,18,12150,Wabash City Schools,8783,1340,278
IN,18,12180,Wabash County Schools Metropolitan School District,12586,2149,222
IN,18,6080,Warren County Metropolitan School District,7161,1213,179
IN,18,12360,Warren Township Metropolitan School District,67452,13475,3023
IN,18,12390,Warrick County School Corporation,62567,11505,804
IN,18,12420,Warsaw Community Schools,41269,7141,874
IN,18,12450,Washington Community School Corporation,18137,3304,566
IN,18,12720,Washington Township Metropolitan School District,92976,13787,2595
IN,18,5550,Wawasee Community School Corporation,20366,3297,334
IN,18,12810,Wayne Township Metropolitan School District,85829,15260,3343
IN,18,4500,Wes-Del Community Schools,5273,784,126
IN,18,9360,West Central School Corporation,4440,801,112
IN,18,9370,West Clark Community Schools,28708,5056,473
IN,18,12870,West Lafayette Community School Corporation,27829,2444,216
IN,18,12900,West Noble School Corporation,12947,2694,294
IN,18,12930,West Washington School Corporation,5655,999,145
IN,18,12990,Western Boone County Community School Corporation,11141,2060,148
IN,18,4470,Western School Corporation,12993,2520,259
IN,18,13050,Western Wayne Schools,5820,1024,150
IN,18,13080,Westfield-Washington Schools,39535,8157,338
IN,18,13110,Westview School Corporation,20044,5542,521
IN,18,8,White River Valley School District,5579,895,144
IN,18,13200,Whiting School City,4524,813,185
IN,18,13230,Whitko Community School Corporation,10810,1956,269
IN,18,2280,Whitley County Consolidated Schools,23383,3928,287
IN,18,2830,Zionsville Community Schools,28851,6732,90